{
  "appId": "notes-lite",
  "checkedAt": "2026-05-28T00:00:00Z",
  "status": "pass",
  "checks": [
    {
      "id": "main-landmark",
      "status": "pass",
      "message": "main landmark exists",
      "selector": "main"
    },
    {
      "id": "button-names",
      "status": "pass",
      "message": "buttons have accessible names",
      "selector": "button"
    }
  ]
}
